{
  "schemaVersion": 1,
  "bankVersion": "diagnostic-v1-bank.2.0.0-candidate",
  "status": "CANDIDATE_NOT_APPROVED",
  "assessmentId": "aiielts-starter-diagnostic",
  "blueprintVersion": "diag-blueprint.2-candidate",
  "questionSetVersion": "form-b.r1-candidate",
  "formId": "form-b",
  "title": "Diagnostic candidate form B",
  "instructions": "Review candidate only. Not approved for learner scoring. No hints or answer keys belong in a future strict attempt.",
  "trackApplicability": [
    "ACADEMIC",
    "GENERAL_TRAINING",
    "UNDECIDED"
  ],
  "sections": [
    {
      "domain": "grammar",
      "questionIds": [
        "diagv1.b.g01.r1",
        "diagv1.b.g02.r1",
        "diagv1.b.g03.r1",
        "diagv1.b.g04.r1",
        "diagv1.b.g05.r1",
        "diagv1.b.g06.r1"
      ]
    },
    {
      "domain": "vocabulary",
      "questionIds": [
        "diagv1.b.v01.r1",
        "diagv1.b.v02.r1",
        "diagv1.b.v03.r1",
        "diagv1.b.v04.r1",
        "diagv1.b.v05.r1",
        "diagv1.b.v06.r1"
      ]
    },
    {
      "domain": "reading",
      "questionIds": [
        "diagv1.b.r01.r1",
        "diagv1.b.r02.r1",
        "diagv1.b.r03.r1",
        "diagv1.b.r04.r1",
        "diagv1.b.r05.r1"
      ]
    },
    {
      "domain": "listening",
      "questionIds": [
        "diagv1.b.l01.r1",
        "diagv1.b.l02.r1",
        "diagv1.b.l03.r1",
        "diagv1.b.l04.r1",
        "diagv1.b.l05.r1"
      ]
    },
    {
      "domain": "writing",
      "questionIds": [
        "diagv1.b.writing01.r1"
      ]
    },
    {
      "domain": "speaking",
      "questionIds": [
        "diagv1.b.speaking01.r1"
      ]
    },
    {
      "domain": "familiarity",
      "questionIds": [
        "diagv1.b.i01.r1",
        "diagv1.b.i02.r1",
        "diagv1.b.i03.r1",
        "diagv1.b.i04.r1",
        "diagv1.b.i05.r1"
      ]
    }
  ],
  "objectiveItems": [
    {
      "questionId": "diagv1.b.g01.r1",
      "domain": "grammar",
      "skill": "subject_verb_agreement",
      "kind": "SINGLE_CHOICE",
      "prompt": "Choose the sentence with correct subject–verb agreement.",
      "instructions": "Choose one answer.",
      "options": [
        {
          "optionId": "opt.a6811a436d3fa1bd8ba1",
          "label": "The laboratory close at six every evening."
        },
        {
          "optionId": "opt.3687af33b3fce59d1fef",
          "label": "The laboratories closes at six every evening."
        },
        {
          "optionId": "opt.40f40c5aea51e142030b",
          "label": "The laboratories is closing at six every evening."
        },
        {
          "optionId": "opt.5cdcc1f576cfaeedef59",
          "label": "The laboratory closes at six every evening."
        }
      ],
      "stimulusId": null
    },
    {
      "questionId": "diagv1.b.g02.r1",
      "domain": "grammar",
      "skill": "present_perfect",
      "kind": "SINGLE_CHOICE",
      "prompt": "Choose the present perfect simple form: The researchers ______ the results, so we can read them now.",
      "instructions": "Choose one answer.",
      "options": [
        {
          "optionId": "opt.648063db26ac9a67b8e2",
          "label": "have published"
        },
        {
          "optionId": "opt.05f4d8f68552f548969e",
          "label": "published"
        },
        {
          "optionId": "opt.d5ad00f8a4383d9a6ba0",
          "label": "had published"
        },
        {
          "optionId": "opt.bd0823116ac985cb1a11",
          "label": "are publishing"
        }
      ],
      "stimulusId": null
    },
    {
      "questionId": "diagv1.b.g03.r1",
      "domain": "grammar",
      "skill": "second_conditional",
      "kind": "SINGLE_CHOICE",
      "prompt": "Choose the conventional second-conditional form: If I lived nearer the college, I ______ there every day.",
      "instructions": "Choose one answer.",
      "options": [
        {
          "optionId": "opt.a4d937f8fd0a0e580aca",
          "label": "will walk"
        },
        {
          "optionId": "opt.6ec55d606e4126e041f0",
          "label": "had walked"
        },
        {
          "optionId": "opt.49436cb8bc87659fad57",
          "label": "am walking"
        },
        {
          "optionId": "opt.e89e72ac5d9a233b1517",
          "label": "would walk"
        }
      ],
      "stimulusId": null
    },
    {
      "questionId": "diagv1.b.g04.r1",
      "domain": "grammar",
      "skill": "past_perfect",
      "kind": "SINGLE_CHOICE",
      "prompt": "Choose the past perfect simple form: When the bus reached the stop, the passengers ______ a queue.",
      "instructions": "Choose one answer.",
      "options": [
        {
          "optionId": "opt.026ad0e9a0a6aa0f3c70",
          "label": "have formed"
        },
        {
          "optionId": "opt.0f1b6426f7d4e68d14a2",
          "label": "had formed"
        },
        {
          "optionId": "opt.0700d1b6b9f6880ad6f4",
          "label": "are forming"
        },
        {
          "optionId": "opt.cf86c34d844f9cfeccbc",
          "label": "will form"
        }
      ],
      "stimulusId": null
    },
    {
      "questionId": "diagv1.b.g05.r1",
      "domain": "grammar",
      "skill": "uncountable_nouns",
      "kind": "SINGLE_CHOICE",
      "prompt": "Which sentence uses advice correctly as an uncountable noun?",
      "instructions": "Choose one answer.",
      "options": [
        {
          "optionId": "opt.bd6c3ee624ab9da7f58c",
          "label": "The adviser gave me an useful advice."
        },
        {
          "optionId": "opt.2c8035a58acefed414e7",
          "label": "The adviser gave me many useful advices."
        },
        {
          "optionId": "opt.c65b8cd911c15f572d10",
          "label": "The adviser gave me some useful advice."
        },
        {
          "optionId": "opt.e6d048e8844053b852e5",
          "label": "The useful advice were clear."
        }
      ],
      "stimulusId": null
    },
    {
      "questionId": "diagv1.b.g06.r1",
      "domain": "grammar",
      "skill": "mixed_conditional",
      "kind": "SINGLE_CHOICE",
      "prompt": "Choose the present-result form of a mixed conditional: If the town had built the bridge last year, journeys across the river ______ shorter now.",
      "instructions": "Choose one answer.",
      "options": [
        {
          "optionId": "opt.5165af6164da585c1dbc",
          "label": "would be"
        },
        {
          "optionId": "opt.a3f92f449cd797d682ce",
          "label": "would have been"
        },
        {
          "optionId": "opt.fcc7d83946237a5d1c98",
          "label": "had been"
        },
        {
          "optionId": "opt.833d9dc1ece1259753c3",
          "label": "will be"
        }
      ],
      "stimulusId": null
    },
    {
      "questionId": "diagv1.b.v01.r1",
      "domain": "vocabulary",
      "skill": "meaning_recognition",
      "kind": "SINGLE_CHOICE",
      "prompt": "The instructions were concise. What does concise mean here?",
      "instructions": "Choose one answer.",
      "options": [
        {
          "optionId": "opt.0d884fb503ee964b3dc5",
          "label": "Repeated several times."
        },
        {
          "optionId": "opt.42107c2345ebb1956990",
          "label": "Brief while giving the necessary information."
        },
        {
          "optionId": "opt.7bc25bcbfaa61ae4761f",
          "label": "Difficult to read because of poor handwriting."
        },
        {
          "optionId": "opt.8361ea69e4a893654ecb",
          "label": "Incomplete because every important step is missing."
        }
      ],
      "stimulusId": null
    },
    {
      "questionId": "diagv1.b.v02.r1",
      "domain": "vocabulary",
      "skill": "word_form",
      "kind": "SINGLE_CHOICE",
      "prompt": "The new bus route has improved the ______ of the town centre.",
      "instructions": "Choose one answer.",
      "options": [
        {
          "optionId": "opt.62425c2ad67313d88d0a",
          "label": "accessible"
        },
        {
          "optionId": "opt.60b5a99f7e2a908a0096",
          "label": "accessibly"
        },
        {
          "optionId": "opt.4d60ab5d88feab1a447d",
          "label": "accessing"
        },
        {
          "optionId": "opt.370703903eeab3189398",
          "label": "accessibility"
        }
      ],
      "stimulusId": null
    },
    {
      "questionId": "diagv1.b.v03.r1",
      "domain": "vocabulary",
      "skill": "academic_word_choice",
      "kind": "SINGLE_CHOICE",
      "prompt": "The researchers repeated the experiment to check whether its results were ______.",
      "instructions": "Choose one answer.",
      "options": [
        {
          "optionId": "opt.9d439598e4049d5e3323",
          "label": "reliably"
        },
        {
          "optionId": "opt.a5c086c6f959f8ab4ce2",
          "label": "reliance"
        },
        {
          "optionId": "opt.319f4ee005e15f498048",
          "label": "reliable"
        },
        {
          "optionId": "opt.20a2b710fba42be21b37",
          "label": "rely"
        }
      ],
      "stimulusId": null
    },
    {
      "questionId": "diagv1.b.v04.r1",
      "domain": "vocabulary",
      "skill": "meaning_in_context",
      "kind": "SINGLE_CHOICE",
      "prompt": "In \"The council postponed the meeting until Friday\", postponed means:",
      "instructions": "Choose one answer.",
      "options": [
        {
          "optionId": "opt.83cc9a8e21ae06b13130",
          "label": "Ended it permanently."
        },
        {
          "optionId": "opt.691da90ca46ef1904f52",
          "label": "Moved it to a later time."
        },
        {